{
  "$schema": "https://json-schema.org/draft/2020-12/schema",
  "$id": "urn:codex-proxy-guardian:config:v1",
  "title": "Codex Proxy Guardian configuration",
  "type": "object",
  "required": ["SchemaVersion", "Mode", "PollSeconds", "ProxyTestUrls", "CodexPackageNames"],
  "properties": {
    "SchemaVersion": { "const": 1 },
    "Mode": { "enum": ["Safe", "Enforce"] },
    "AutomaticUpdates": { "type": "boolean" },
    "NotifyAfterAutomaticUpdate": { "type": "boolean" },
    "UpdateChannel": { "enum": ["Stable", "Prerelease"] },
    "PollSeconds": { "type": "integer", "minimum": 2, "maximum": 300 },
    "StableSamples": { "type": "integer", "minimum": 1, "maximum": 100 },
    "DebounceSeconds": { "type": "integer", "minimum": 0, "maximum": 600 },
    "ExternalLaunchDebounceSeconds": { "type": "integer", "minimum": 0, "maximum": 600 },
    "SafeRepairExternalCodexLaunches": { "type": "boolean" },
    "EnableInPlaceProxyRelay": { "type": "boolean" },
    "RequireManagedLaunchForStreaming": { "type": "boolean" },
    "SafeExternalLaunchGraceSeconds": { "type": "integer", "minimum": 10, "maximum": 600 },
    "NotifyBeforeCodexRestart": { "type": "boolean" },
    "RestartPromptTimeoutSeconds": { "type": "integer", "minimum": 15, "maximum": 300 },
    "RestartPromptSnoozeMinutes": { "type": "integer", "minimum": 1, "maximum": 1440 },
    "RestartCooldownSeconds": { "type": "integer", "minimum": 10, "maximum": 3600 },
    "RestartLimitCount": { "type": "integer", "minimum": 1, "maximum": 100 },
    "RestartLimitWindowMinutes": { "type": "integer", "minimum": 1, "maximum": 1440 },
    "CircuitBreakerMinutes": { "type": "integer", "minimum": 1, "maximum": 1440 },
    "RecoveryLaunchRetrySeconds": { "type": "integer", "minimum": 5, "maximum": 600 },
    "GracefulCloseSeconds": { "type": "integer", "minimum": 0, "maximum": 60 },
    "TcpTimeoutMilliseconds": { "type": "integer", "minimum": 100, "maximum": 10000 },
    "HttpTimeoutSeconds": { "type": "integer", "minimum": 1, "maximum": 60 },
    "HttpValidationIntervalSeconds": { "type": "integer", "minimum": 1, "maximum": 3600 },
    "PostUpdateStabilityEnabled": { "type": "boolean" },
    "PostUpdateStabilitySamples": { "type": "integer", "minimum": 1, "maximum": 20 },
    "PostUpdateStabilitySeconds": { "type": "integer", "minimum": 0, "maximum": 3600 },
    "CheckForGuardianUpdateOnCodexChange": { "type": "boolean" },
    "CompatibilityUpdateRetryMinutes": { "type": "integer", "minimum": 5, "maximum": 1440 },
    "GuardianUpdateCheckIntervalMinutes": { "type": "integer", "minimum": 15, "maximum": 1440 },
    "UpdateHeartbeatEvaluationSeconds": { "type": "integer", "minimum": 15, "maximum": 3600 },
    "CodexCompatibilityConfirmationSeconds": { "type": "integer", "minimum": 15, "maximum": 600 },
    "EventListenerDebounceMilliseconds": { "type": "integer", "minimum": 250, "maximum": 10000 },
    "ReconnectSignalDedupeMinutes": { "type": "integer", "minimum": 1, "maximum": 1440 },
    "ReconnectSignalWindowSeconds": { "type": "integer", "minimum": 10, "maximum": 3600 },
    "ReconnectLogMaxReadBytes": { "type": "integer", "minimum": 65536, "maximum": 4194304 },
    "CodexLogRoot": { "type": "string" },
    "CodexSqliteLogPath": { "type": "string" },
    "EnableCodexSystemProxyAdaptation": { "type": "boolean" },
    "UnavailableLogIntervalSeconds": { "type": "integer", "minimum": 30, "maximum": 86400 },
    "ExplicitProxy": { "type": "string" },
    "ExplicitPAC": { "type": "string" },
    "AllowNonLoopbackProxy": { "type": "boolean" },
    "AllowSystemNonLoopbackProxy": { "type": "boolean" },
    "EnableEnvironmentProxyDiscovery": { "type": "boolean" },
    "EnablePACDiscovery": { "type": "boolean" },
    "EnableWPADDiscovery": { "type": "boolean" },
    "PacFetchTimeoutSeconds": { "type": "integer", "minimum": 1, "maximum": 30 },
    "PacExecutionTimeoutMilliseconds": { "type": "integer", "minimum": 50, "maximum": 5000 },
    "PacMaxBytes": { "type": "integer", "minimum": 1024, "maximum": 8388608 },
    "PacCacheMinutes": { "type": "integer", "minimum": 1, "maximum": 1440 },
    "ProxyTestUrls": {
      "type": "array",
      "minItems": 1,
      "items": { "type": "string", "format": "uri", "pattern": "^https://" }
    },
    "MinimumSuccessfulProxyTests": { "type": "integer", "minimum": 1, "maximum": 20 },
    "RequiredProxyTestHosts": {
      "type": "array",
      "items": { "type": "string", "minLength": 1 }
    },
    "PreferredProxyProcesses": { "type": "array", "items": { "type": "string" } },
    "PreferredProxyPorts": { "type": "array", "items": { "type": "integer", "minimum": 1, "maximum": 65535 } },
    "MaxProcessProxyCandidates": { "type": "integer", "minimum": 1, "maximum": 50 },
    "CodexPackageNames": { "type": "array", "minItems": 1, "items": { "type": "string" } },
    "CodexApplicationId": { "type": "string" },
    "PreferredCodexExecutables": { "type": "array", "minItems": 1, "items": { "type": "string", "minLength": 1 } },
    "CodexResolveIntervalSeconds": { "type": "integer", "minimum": 10, "maximum": 3600 },
    "ProxyConnectionEvidenceWindowSeconds": { "type": "integer", "minimum": 30, "maximum": 3600 },
    "UseChromiumProxyArgument": { "type": "boolean" },
    "ManageExternalCodexLaunches": { "type": "boolean" },
    "NoProxy": { "type": "string" },
    "LogRetentionDays": { "type": "integer", "minimum": 1, "maximum": 365 },
    "MaxLogFiles": { "type": "integer", "minimum": 1, "maximum": 1000 },
    "MaxLogFileMB": { "type": "integer", "minimum": 1, "maximum": 100 }
  },
  "additionalProperties": true
}
