{
  "SchemaVersion": 1,
  "Mode": "Safe",
  "AutomaticUpdates": true,
  "NotifyAfterAutomaticUpdate": true,
  "UpdateChannel": "Stable",
  "PollSeconds": 5,
  "StableSamples": 3,
  "DebounceSeconds": 10,
  "ExternalLaunchDebounceSeconds": 15,
  "SafeRepairExternalCodexLaunches": true,
  "EnableInPlaceProxyRelay": true,
  "RequireManagedLaunchForStreaming": true,
  "SafeExternalLaunchGraceSeconds": 20,
  "NotifyBeforeCodexRestart": false,
  "RestartPromptTimeoutSeconds": 45,
  "RestartPromptSnoozeMinutes": 10,
  "RestartCooldownSeconds": 45,
  "RestartLimitCount": 3,
  "RestartLimitWindowMinutes": 10,
  "CircuitBreakerMinutes": 15,
  "RecoveryLaunchRetrySeconds": 10,
  "GracefulCloseSeconds": 10,
  "TcpTimeoutMilliseconds": 1500,
  "HttpTimeoutSeconds": 8,
  "HttpValidationIntervalSeconds": 30,
  "PostUpdateStabilityEnabled": true,
  "PostUpdateStabilitySamples": 3,
  "PostUpdateStabilitySeconds": 60,
  "CheckForGuardianUpdateOnCodexChange": true,
  "CompatibilityUpdateRetryMinutes": 15,
  "GuardianUpdateCheckIntervalMinutes": 60,
  "UpdateHeartbeatEvaluationSeconds": 30,
  "CodexCompatibilityConfirmationSeconds": 45,
  "EventListenerDebounceMilliseconds": 1000,
  "ReconnectSignalDedupeMinutes": 10,
  "ReconnectSignalWindowSeconds": 120,
  "ReconnectLogMaxReadBytes": 262144,
  "CodexLogRoot": "",
  "CodexSqliteLogPath": "",
  "UnavailableLogIntervalSeconds": 300,
  "ProxyTestUrls": [
    "https://api.openai.com/v1/models",
    "https://chatgpt.com/",
    "https://auth.openai.com/"
  ],
  "MinimumSuccessfulProxyTests": 2,
  "RequiredProxyTestHosts": [
    "chatgpt.com"
  ],
  "ExplicitProxy": "",
  "ExplicitPAC": "",
  "AllowNonLoopbackProxy": false,
  "AllowSystemNonLoopbackProxy": true,
  "EnableEnvironmentProxyDiscovery": true,
  "EnablePACDiscovery": true,
  "EnableWPADDiscovery": true,
  "PacFetchTimeoutSeconds": 5,
  "PacExecutionTimeoutMilliseconds": 500,
  "PacMaxBytes": 1048576,
  "PacCacheMinutes": 5,
  "PreferredProxyProcesses": [
    "verge-mihomo*",
    "mihomo*",
    "clash*",
    "clash-verge*",
    "clash-nyanpasu*",
    "mihomo-party*",
    "v2ray*",
    "v2rayN*",
    "xray*",
    "sing-box*",
    "singbox*",
    "shadowsocks*",
    "nekoray*",
    "nekobox*",
    "hiddify*",
    "FlClash*"
  ],
  "PreferredProxyPorts": [
    7890,
    7891,
    7892,
    7893,
    7894,
    7895,
    7896,
    7897,
    1080,
    10808,
    10809,
    2080,
    8080
  ],
  "MaxProcessProxyCandidates": 6,
  "CodexPackageNames": [
    "OpenAI.Codex"
  ],
  "CodexApplicationId": "",
  "PreferredCodexExecutables": [
    "ChatGPT.exe",
    "Codex.exe"
  ],
  "CodexResolveIntervalSeconds": 60,
  "ProxyConnectionEvidenceWindowSeconds": 300,
  "UseChromiumProxyArgument": true,
  "ManageExternalCodexLaunches": false,
  "NoProxy": "localhost,127.0.0.1,::1",
  "LogRetentionDays": 14,
  "MaxLogFiles": 20,
  "MaxLogFileMB": 5
}
